{"admissionEffect":"Q_and_W_A012_only","authority":"root_owned_scoped_harmonic_descriptor","candidateFingerprint":"b2cf9997b6e52b87a0a2c30125a9600ec2317879231d6f54e13814ea61d494d1","candidateId":"CH_A012_q_v1","coordinateId":"harmonic.CH_A012_q_v1","deferredWork":["full_462_state_collision_analysis","D1_D7_anchor_extension","satellite_and_boundary_extension","fifteen_operator_delta_audit","C_P_C_H_C_S_correspondence_evaluation"],"globalAggregate":{"guardLiteral":"C_H is a derived harmonic property, not a photonic measurement, not C_P, not C_S, not kappa_court, and not a thermodynamic quantity: not temperature, entropy, enthalpy, or free energy.","namespace":"harmonic.C_H","status":"unresolved","value":null},"invariants":{"a0A1Gap":{"denominator":407,"numerator":3},"a0Order":["Lydian","Ionian","Mixolydian","Dorian","Aeolian","Phrygian","Locrian"],"a1A2Gap":{"denominator":407,"numerator":22},"fibonacciObservation":{"observationId":"CH-OBS-001","status":"observed_noncausal"},"governorSeatClass":2,"governorSeatPassCount":21,"strictBandSeparation":true,"tierSumOrder":[5,8,13]},"method":{"algorithmVersion":"gov-213.rooted-triad-q-v1.v1","degreeOrder":[1,2,3,4,5,6,7],"governorDegreeMap":{"Jupiter":2,"Mars":3,"Mercury":6,"Moon":7,"Saturn":1,"Sun":4,"Venus":5},"qClasses":[{"runtimeQuality":"major","signature":[4,7],"value":0},{"runtimeQuality":"minor","signature":[3,7],"value":1},{"runtimeQuality":"diminished","signature":[3,6],"value":2},{"runtimeQuality":"augmented","signature":[4,8],"value":2},{"runtimeQuality":"other","signature":[2,6],"value":3},{"runtimeQuality":"other","signature":[4,6],"value":3}],"qVersion":"q_v1","triadDerivation":"court_mathematics.DegreeTriad","uniquenessClaim":false,"weightDenominator":407,"weightNumerators":[116,56,41,35,77,44,38],"weightOrdering":"w1>w5>w2>w6>w3>w7>w4>0","weightSum":{"denominator":407,"numerator":407},"weightVersion":"chaldean_order_witness_v1"},"negativeControls":{"boundarySelectionTrap":{"result":"excluded","role":"boundary","stateId":223,"tier":null},"intervalVectorOnlyCollision":{"distinctQCount":7,"forte":"7-35","intervalVector":[2,5,4,3,6,1],"result":"interval_vector_only_cannot_distinguish_rooted_modes","stateCount":7},"tierOnlySelectionTrap":{"result":"excluded","role":"satellite","stateId":687,"tier":"A2"}},"records":[{"forte":"7-35","governorSeatCompressionClass":2,"intervalVector":[2,5,4,3,6,1],"name":"Locrian","pitchClasses":[0,1,3,5,6,8,10],"recordFingerprint":"14095730cb7f0bbfae3ece712692c434a76398395c82902845229b0bb6960735","role":"anchor","stateGovernor":"Saturn","stateGovernorDegree":1,"stateId":1387,"stepIntervals":[1,2,2,1,2,2,2],"tier":"A0","triadIntervalSignatures":[[3,6],[4,7],[3,7],[3,7],[4,7],[4,7],[3,7]],"triadicCompressionSignature":[2,0,1,1,0,0,1],"weightedProjection":{"denominator":407,"numerator":346}},{"forte":"7-35","governorSeatCompressionClass":2,"intervalVector":[2,5,4,3,6,1],"name":"Phrygian","pitchClasses":[0,1,3,5,7,8,10],"recordFingerprint":"edd045cea12875ef823fd8ea9125e25ec4b4754276cbf101a56a1f7a322c692c","role":"anchor","stateGovernor":"Venus","stateGovernorDegree":5,"stateId":1451,"stepIntervals":[1,2,2,2,1,2,2],"tier":"A0","triadIntervalSignatures":[[3,7],[4,7],[4,7],[3,7],[3,6],[4,7],[3,7]],"triadicCompressionSignature":[1,0,0,1,2,0,1],"weightedProjection":{"denominator":407,"numerator":343}},{"forte":"7-35","governorSeatCompressionClass":2,"intervalVector":[2,5,4,3,6,1],"name":"Aeolian","pitchClasses":[0,2,3,5,7,8,10],"recordFingerprint":"5559bb965648b1cf321d8c7fba5a4e1987b8bba085e3aff60427e0da277e1ef3","role":"anchor","stateGovernor":"Jupiter","stateGovernorDegree":2,"stateId":1453,"stepIntervals":[2,1,2,2,1,2,2],"tier":"A0","triadIntervalSignatures":[[3,7],[3,6],[4,7],[3,7],[3,7],[4,7],[4,7]],"triadicCompressionSignature":[1,2,0,1,1,0,0],"weightedProjection":{"denominator":407,"numerator":340}},{"forte":"7-35","governorSeatCompressionClass":2,"intervalVector":[2,5,4,3,6,1],"name":"Dorian","pitchClasses":[0,2,3,5,7,9,10],"recordFingerprint":"39d0e25792e364d30a67e011b0294090ae548d47c7216c4007afd7672830bf45","role":"anchor","stateGovernor":"Mercury","stateGovernorDegree":6,"stateId":1709,"stepIntervals":[2,1,2,2,2,1,2],"tier":"A0","triadIntervalSignatures":[[3,7],[3,7],[4,7],[4,7],[3,7],[3,6],[4,7]],"triadicCompressionSignature":[1,1,0,0,1,2,0],"weightedProjection":{"denominator":407,"numerator":337}},{"forte":"7-35","governorSeatCompressionClass":2,"intervalVector":[2,5,4,3,6,1],"name":"Mixolydian","pitchClasses":[0,2,4,5,7,9,10],"recordFingerprint":"9009fd95ab597802e055aa1fa8d4d71e3cd2fa4835c60c5cef34cc40a76f6d52","role":"anchor","stateGovernor":"Mars","stateGovernorDegree":3,"stateId":1717,"stepIntervals":[2,2,1,2,2,1,2],"tier":"A0","triadIntervalSignatures":[[4,7],[3,7],[3,6],[4,7],[3,7],[3,7],[4,7]],"triadicCompressionSignature":[0,1,2,0,1,1,0],"weightedProjection":{"denominator":407,"numerator":259}},{"forte":"7-35","governorSeatCompressionClass":2,"intervalVector":[2,5,4,3,6,1],"name":"Ionian","pitchClasses":[0,2,4,5,7,9,11],"recordFingerprint":"b42defc0282901397cc5c202daf085aa8853c6d4429ca739731ca7aed7dd78d1","role":"anchor","stateGovernor":"Moon","stateGovernorDegree":7,"stateId":2741,"stepIntervals":[2,2,1,2,2,2,1],"tier":"A0","triadIntervalSignatures":[[4,7],[3,7],[3,7],[4,7],[4,7],[3,7],[3,6]],"triadicCompressionSignature":[0,1,1,0,0,1,2],"weightedProjection":{"denominator":407,"numerator":217}},{"forte":"7-35","governorSeatCompressionClass":2,"intervalVector":[2,5,4,3,6,1],"name":"Lydian","pitchClasses":[0,2,4,6,7,9,11],"recordFingerprint":"b55094bf613e4b7d3d98fa23d81947212eacd3061d1acce0a0566c1ab6a3ba41","role":"anchor","stateGovernor":"Sun","stateGovernorDegree":4,"stateId":2773,"stepIntervals":[2,2,2,1,2,2,1],"tier":"A0","triadIntervalSignatures":[[4,7],[4,7],[3,7],[3,6],[4,7],[3,7],[3,7]],"triadicCompressionSignature":[0,0,1,2,0,1,1],"weightedProjection":{"denominator":407,"numerator":193}},{"forte":"7-34","governorSeatCompressionClass":2,"intervalVector":[2,5,4,4,4,2],"name":"Superlocrian","pitchClasses":[0,1,3,4,6,8,10],"recordFingerprint":"d62854d515ba36f02dea86d595eca96e9a28c8ce8320841efb3829bc986caf26","role":"anchor","stateGovernor":"Sun","stateGovernorDegree":4,"stateId":1371,"stepIntervals":[1,2,1,2,2,2,2],"tier":"A1","triadIntervalSignatures":[[3,6],[3,7],[3,7],[4,8],[4,7],[4,7],[3,6]],"triadicCompressionSignature":[2,1,1,2,0,0,2],"weightedProjection":{"denominator":407,"numerator":475}},{"forte":"7-34","governorSeatCompressionClass":2,"intervalVector":[2,5,4,4,4,2],"name":"Half-Diminished","pitchClasses":[0,2,3,5,6,8,10],"recordFingerprint":"bc564857e2027a215fb8a6460d17f1ec816e147d203af73569b02034a18d2f84","role":"anchor","stateGovernor":"Venus","stateGovernorDegree":5,"stateId":1389,"stepIntervals":[2,1,2,1,2,2,2],"tier":"A1","triadIntervalSignatures":[[3,6],[3,6],[3,7],[3,7],[4,8],[4,7],[4,7]],"triadicCompressionSignature":[2,2,1,1,2,0,0],"weightedProjection":{"denominator":407,"numerator":574}},{"forte":"7-34","governorSeatCompressionClass":2,"intervalVector":[2,5,4,4,4,2],"name":"Mixolydian ♭6","pitchClasses":[0,2,4,5,7,8,10],"recordFingerprint":"38a960885e4d68cc51b24e261c84eaad8294b27f75682745d214b57f5ce327b2","role":"anchor","stateGovernor":"Mercury","stateGovernorDegree":6,"stateId":1461,"stepIntervals":[2,2,1,2,1,2,2],"tier":"A1","triadIntervalSignatures":[[4,7],[3,6],[3,6],[3,7],[3,7],[4,8],[4,7]],"triadicCompressionSignature":[0,2,2,1,1,2,0],"weightedProjection":{"denominator":407,"numerator":394}},{"forte":"7-34","governorSeatCompressionClass":2,"intervalVector":[2,5,4,4,4,2],"name":"Dorian ♭2","pitchClasses":[0,1,3,5,7,9,10],"recordFingerprint":"216a5b642c2410cd5952553438d3bfcf0f7678e1b527f3e18dfe53e4ca58adcd","role":"anchor","stateGovernor":"Jupiter","stateGovernorDegree":2,"stateId":1707,"stepIntervals":[1,2,2,2,2,1,2],"tier":"A1","triadIntervalSignatures":[[3,7],[4,8],[4,7],[4,7],[3,6],[3,6],[3,7]],"triadicCompressionSignature":[1,2,0,0,2,2,1],"weightedProjection":{"denominator":407,"numerator":508}},{"forte":"7-34","governorSeatCompressionClass":2,"intervalVector":[2,5,4,4,4,2],"name":"Acoustic","pitchClasses":[0,2,4,6,7,9,10],"recordFingerprint":"8dca13baaa1107f44ebc872ba4674ca32f8c1a8afc4dce8b8d488297d84e0759","role":"anchor","stateGovernor":"Moon","stateGovernorDegree":7,"stateId":1749,"stepIntervals":[2,2,2,1,2,1,2],"tier":"A1","triadIntervalSignatures":[[4,7],[4,7],[3,6],[3,6],[3,7],[3,7],[4,8]],"triadicCompressionSignature":[0,0,2,2,1,1,2],"weightedProjection":{"denominator":407,"numerator":349}},{"forte":"7-34","governorSeatCompressionClass":2,"intervalVector":[2,5,4,4,4,2],"name":"Melodic Minor","pitchClasses":[0,2,3,5,7,9,11],"recordFingerprint":"4726e65b8bbd78bca26a2879b1f9f877880f627cca072c0631bc734f2ad96e5b","role":"anchor","stateGovernor":"Mars","stateGovernorDegree":3,"stateId":2733,"stepIntervals":[2,1,2,2,2,2,1],"tier":"A1","triadIntervalSignatures":[[3,7],[3,7],[4,8],[4,7],[4,7],[3,6],[3,6]],"triadicCompressionSignature":[1,1,2,0,0,2,2],"weightedProjection":{"denominator":407,"numerator":418}},{"forte":"7-34","governorSeatCompressionClass":2,"intervalVector":[2,5,4,4,4,2],"name":"Lydian Augmented","pitchClasses":[0,2,4,6,8,9,11],"recordFingerprint":"554171e1d662d7fd033d84eef90284217493490de255c77e587194c686860dc9","role":"anchor","stateGovernor":"Saturn","stateGovernorDegree":1,"stateId":2901,"stepIntervals":[2,2,2,2,1,2,1],"tier":"A1","triadIntervalSignatures":[[4,8],[4,7],[4,7],[3,6],[3,6],[3,7],[3,7]],"triadicCompressionSignature":[2,0,0,2,2,1,1],"weightedProjection":{"denominator":407,"numerator":538}},{"forte":"7-33","governorSeatCompressionClass":2,"intervalVector":[2,6,2,6,2,3],"name":"Leading Whole-Tone Inverse","pitchClasses":[0,1,2,4,6,8,10],"recordFingerprint":"dd0775ba7acf3522f0521b4555f1ee9719c7838be5940cbcc11984872dbf2199","role":"anchor","stateGovernor":"Moon","stateGovernorDegree":7,"stateId":1367,"stepIntervals":[1,1,2,2,2,2,2],"tier":"A2","triadIntervalSignatures":[[2,6],[3,7],[4,8],[4,8],[4,7],[4,6],[3,6]],"triadicCompressionSignature":[3,1,2,2,0,3,2